{
  "spec": "page-design-ai-v1",
  "version": 1,
  "pageSize": "a4",
  "orientation": "portrait",
  "backgroundColor": "#ffffff",
  "elements": [
    {
      "kind": "text",
      "text": "Generated by AI",
      "x": 80,
      "y": 90,
      "fontSize": 52,
      "fontFamily": "Arial",
      "fontWeight": "700",
      "fill": "#1f2937"
    },
    {
      "kind": "rect",
      "x": 72,
      "y": 180,
      "width": 460,
      "height": 160,
      "rx": 12,
      "ry": 12,
      "fill": "#eef7ee",
      "stroke": "#2f7a47",
      "strokeWidth": 2
    },
    {
      "kind": "line",
      "x1": 0,
      "y1": 0,
      "x2": 420,
      "y2": 0,
      "left": 80,
      "top": 380,
      "stroke": "#264d35",
      "strokeWidth": 3
    }
  ]
}
